Data Processing_ NYC_Taxi/Ad-Hoc query results/part_2_Q2.csv

taxi_type,avg_duration_min,median_duration_min,min_duration_min,max_duration_min,avg_trip_distance_km,median_trip_distance_km,min_trip_distance_km,max_trip_distance_km,avg_speed_km,median_speed_km,min_speed_km,max_speed_km
green,13.63,10.55,1.02,300,4.79,3.12,0.16,160.89,20.44,18.56,0.04,321.87
yellow,14.42,11.28,1.02,300,4.91,2.75,0.16,160.93,18.9,16.58,0.03,321.87

Data Processing_ NYC_Taxi/README.md

### Q2. For each taxi colour (yellow and green):

Green taxis averages 13.63 minutes per trip, while yellow taxis average slightly longer at 14.42 minutes. Median durations are 10.55 minutes for green and 11.28 minutes for yellow taxis, with both having a minimum of 1 minutes and a maximum of 300 minutes.

#### b. What was the average, median, minimum and maximum trip distance in km?:

The average trip distance is similar, 4.79 km for green and 4.91 km for yellow taxis. Green taxis have a higher median distance (3.12 km vs. 2.75 km). Both share a minimum of 0.16 km and a maximum of 160 km. From Q.2a Green taxis likely serve longer trips, operating outside central Manhattan.

#### c. What was the average, median, minimum and maximum speed in km per hour?:

Green taxis averae 20.44 km/h, slightly faster than yellow taxis at 18.9 km/h. Median speeds tell the same story (18.56 km/h for green & 16.58 km/h for yellow). Both peak at 321 km/h (likely outliers) and drop to 0.04 km/h due to traffic. Overall, Green taxis move faster, operating outside Manhattan's heavy congestion.